Level_Code,University,City,Course,Faculty,Int_Fees,Local_Fees,Currency,Currency_Time,Duration,Duration_Time,Full_Time,Part_Time,Prerequisite_1,Prerequisite_2,Prerequisite_3,Prerequisite_1_grade,Prerequisite_2_grade,Prerequisite_3_grade,Website,Course_Lang,Availability,Description,Career_Outcomes,Country,Online,Offline,Distance,Face_to_Face,Blended,Remarks
PG,Murdoch University,Perth,Master of Communication,Mass Communication & Media,,,AUD,year,2,Years,yes,yes,IELTS,,,6.5,,,https://www.murdoch.edu.au/study/courses/postgraduate/M1277,English,,"Informed by global research and best practice in a range of topics including social media, cultural and media studies, global communication and strategic communication, this degree will extend your personal development and professional expertise, allowing you to apply it to a range of industries and disciplines. This course is designed for communication professionals wanting to develop their existing knowledge and skills, and those new to communications wanting to explore a different career direction or study path. Create strategic communication and research plans for real life clients through in-class and work integrated learning experiences. You’ll analyse and implement the latest practices in communication in both international and Australian contexts through the analysis of case studies and real-life scenarios led by academics and industry guest speakers. Examine the purposes and means by which leaders, organisations and interest groups create, coordinate and direct communication through strategy, planning, and engagement with society, the media and government. 8 reasons to study a Master of Communication at Murdoch Develop your skills Build essential skills and knowledge to meet your career or study goals. Topics you’ll cover include: Your career The Master of Communication will prepare you for executive, managerial and entrepreneurial positions in communication and media related fields. Careers could include: Depending on your own career aspirations, you could pursue a career in industry or continue to study and research.",Not Mentioned,,no,yes,no,yes,no,[]
PG,Murdoch University,Perth,Master of Community Development,Humanities and Social Science,,,AUD,year,2,Years,yes,yes,IELTS,,,6.5,,,https://www.murdoch.edu.au/study/courses/postgraduate/M1212,English,,"This course will introduce you to the community development ideas and practices used to create and foster community-led change in settings around Australia and beyond. This course is designed for community work practitioners and graduates with an interest in moving into emerging fields that embrace the ideas and practices of community development, and want to broaden their knowledge substantially through further postgraduate studies. You'll study real and living community projects that build on cultural strength in remote areas, urban agriculture and sustainability projects, grassroots creative arts projects, activism work and much more. Combine case studies, documentaries, films and other creative digital forms that showcase examples of community work and attend workshops designed to teach creative ways of getting the community involved. 3 reasons to study a Master of Community Development at Murdoch Develop your skills Build essential skills and knowledge to meet your career or study goals. Topics you’ll cover include: Your career When you graduate you could work in many industry areas such as community and social services, local government, humanitarian organisations, NGOs, aid work, economic and social planning, sustainable development and Indigenous governance. Careers could include:",Not Mentioned,,no,yes,no,yes,no,[]
PG,Murdoch University,Perth,Master of Counselling,Humanities and Social Science,,,AUD,year,2,Years,yes,yes,IELTS,,,6.5,,,https://www.murdoch.edu.au/study/courses/postgraduate/M1143,English,,"Counsellors help people through difficult times of their lives, often when they are most vulnerable. Prepare for a career in counselling by building your personal and professional skills. With a focus on building counselling relationships with your clients that are essential to effective practice, you’ll gain the skills you need to succeed in a rewarding career. Apply the theoretical foundations of counselling by first appraising selected counselling literature and research, before undertaking extensive practical training. In your second year, you’ll have the option to complete a substantial research project addressing counselling theory or practice, or choose to complete the course through coursework and case studies. You’ll complete two supervised placements, which will provide you the opportunity to develop skills in assessment, individual and group treatment, working with children and adult clients, working with other professionals and within the supervisory relationship. Build essential skills and knowledge to meet your career or study goals. Topics you’ll cover include: When you graduate, you may be employed in government and non-government counselling organisations working with adults, children, families and couples. This course will also prepare you for employment in settings requiring individual and group therapy competence. Careers could include: This course is accredited by Psychotherapy and Counselling Federation of Australia (PACFA) and Australian Counselling Association (ACA). You will be eligible to apply for intern registration with the Psychotherapy and Counselling Federation of Australia (PACFA) and to then work towards clinical registration with PACFA. As a graduate, you will be eligible to apply for Level 2 membership with the Australian Counselling Association and then work towards Level 3 / 4 clinical membership.",Not Mentioned,,no,yes,no,yes,no,[]
PG,Murdoch University,Perth,Master of Creative Arts Therapies,Medical and Nursing,,,AUD,year,2,Years,yes,yes,IELTS,,,6.5,,,https://www.murdoch.edu.au/study/courses/postgraduate/M1300,English,,"As WA’s only master’s in creative arts therapies, this course is committed to experiential learning through expressive arts psychotherapies in workshops, clinical practice and clinical supervision. You will learn to critically appraise arts psychotherapy literature and gain an understanding of both theoretical knowledge and hands-on creative arts psychotherapy practice. Explore the newly-emerging theory in this area of counselling and gain the hands-on experience that will prepare you to work in a diverse range of clinical and non-clinical contexts, in which building relationships is a key component. This course builds on study in our already-established Graduate Diploma in Creative Arts Therapies. Students who hold this qualification will be granted advanced standing in the Master. Build essential skills and knowledge to meet your career or study goals. Topics you’ll cover include: Creative arts therapies are a form of psychotherapy currently growing in acceptance and popularity in Australia and globally. Counsellors and therapists using artistic modalities such as visual arts, music dance/movement and drama may work with children, adolescents, adults, older adults, groups and families to promote expression, self-awareness and insight. Work settings include schools, hospitals, aged care, crisis centres, wellness centres, detention facilities, remand facilities and addiction treatment. Experienced professionals may also utilise art therapy in private practice. Combined with your existing experience and qualifications your career as a Creative Arts Therapist can begin anywhere and be used in any role where building relationships is a key component. Your skills can be applied in roles such as: You may already be in your dream job and this qualification will provide a stepping stone to enhancing your skills and increasing your potential.",Not Mentioned,,no,yes,no,yes,no,[]
PG,Murdoch University,Perth,Master of Criminology,Law,,,AUD,year,2,Years,yes,yes,IELTS,,,6.5,,,https://www.murdoch.edu.au/study/courses/postgraduate/M1314,English,,"This course will provide you with the skills -to understand the fundamental matters of criminology. Whether you have graduated with a degree in criminology or from another discipline area, you will gain in-depth knowledge and skills to analyse contemporary issues challenging today’s criminal justice system. As a criminology professional, you will need multidisciplinary and applied skills to investigate complex and evolving issues. You will gain an understanding of criminal behaviour and investigate complex crimes such as cybercrimes and terrorism. You will understand developing criminal justice issues, including how criminal law and evidence responds to new crimes, particularly in the business environment.  If you have industry experience, a graduate certificate or graduate diploma, you can use this to obtain an advanced standing into the Master of Criminology, so you can gain your qualification quicker. 3 reasons to study a Master of Criminology at Murdoch Develop your skills Your career A Master of Criminology could see you working in public and private sectors nationally or internationally. Other opportunities of employment include law enforcement, corrections, intelligence, international and cognate entities as well as a range of providers in the broad sphere of criminal justice. Some career pathways could include:",Not Mentioned,,no,yes,no,yes,no,[]
PG,Murdoch University,Perth,Master of Development Studies,Humanities and Social Science,,,AUD,year,2,Years,yes,yes,IELTS,,,6.5,,,https://www.murdoch.edu.au/study/courses/postgraduate/M1195,English,,"Determined to pursue a career in international development and make a difference? This course will prepare you for a range of experiences and roles in the sector, in Australia and internationally. You’ll examine the connections between politics, governance and development, social and environmental sustainability, food and health security, gender and empowerment, and state building and conflict, as well as evaluating different approaches to policy and practice. You can choose from professional-based electives, including financial administration, leading and managing not-for-profit organisations, effective leadership, strategic health care management and project management.  You can also choose policy-based electives to specialise in global public health, public sector economics, security and conflict, environmental policy and more, or add up to two language units in either Indonesian or Japanese. 3 reasons to study a Master of Development Studies at Murdoch Develop your skills Build essential skills and knowledge to meet your career or study goals. Topics you’ll cover include: Your career You’ll graduate with the skills and knowledge you need to pursue a career in international development in a broad range of settings, such as regional and international organisations, government agencies, consultancy firms, and non-government organisations (NGOs) involved in development. Careers could include:",Not Mentioned,,no,yes,no,yes,no,[]
SHORT COURSES,Murdoch University,Perth,Master of Education (Coursework),Education,,,AUD,year,2,Years,yes,yes,IELTS,,,6.5,,,https://www.murdoch.edu.au/study/courses/postgraduate/M1208,English,,"This three-semester coursework degree will provide you with the knowledge and skills required to be a successful leader in the education sector, capable of addressing critical issues in educational practice, policy and research. This course is designed for teachers, educational leaders, administrators, and other education professionals seeking to extend and deepen their expertise, professionals with education roles seeking professional development and renewal, and those planning to proceed to the Doctor of Education. This course will provide you with the knowledge, understanding and skills required to enhance your teaching, leadership and/or administration roles within the education field. You will be capable of planning and implementing educational projects, and leading complex educational initiatives. 8 reasons to study the Master of Education by Coursework at Murdoch Develop your skills Build essential skills and knowledge to meet your career or study goals. Topics you’ll cover include: Your career As a Murdoch education masters graduate, you’ll join an established group of educators who are resilient, confident and making a real difference every day, both locally and around the world. Professional recognition This course does not constitute a teaching qualification and is not accredited by the Teacher Registration Board of Western Australia (TRBWA). Teachers may use completion of units as evidence of professional learning for registration and re-registration.",Not Mentioned,,no,yes,no,yes,no,[]
PG,Murdoch University,Perth,Master of Engineering,Engineering,,,AUD,year,2,Years,yes,yes,IELTS,,,6.5,,,https://www.murdoch.edu.au/study/courses/postgraduate/M1193,English,,"Expand your career prospects or progress your existing career by deepening your engineering skills and knowledge. In this postgraduate degree you’ll learn the latest industry techniques and practices and have access to insights from our industry professionals. You will also take part in specialised workshops on campus as well as off-campus site visits and technology operations sessions. 5 reasons to study Engineering at Murdoch What you’ll learn Your future career A postgraduate qualification in engineering could lead you to a variety of roles anywhere in the world. You might use your advanced skills in your chosen area of engineering in a range of roles, such as:",Senior or Principal Engineer / Engineering Manager / Director of Engineering,,no,yes,no,yes,no,[]
PG,Murdoch University,Perth,Master of Engineering / Master of Information Technology,Engineering,,,AUD,year,2,Years,yes,yes,IELTS,,,6.5,,,https://www.murdoch.edu.au/study/courses/postgraduate/M1305,English,,"In this course you will develop your knowledge and skillset to work on engineering projects that include machine learning, complex data, data analysis and internetworking and security. As well as gaining an understanding of contemporary engineering practice and methods, you will also learn how to apply systematic approaches to manage and lead engineering and information technology projects by planning and executing a substantial engineering and IT project within the field of your specific major. This course addresses the needs of engineers and IT experts to better understand and capture the needs of each other. As part of this combined Master course, you will have the choice to major in either Industrial Control Systems Engineering or Electrical Power Engineering as well as a choice to major in either Data Science or Internetworking and Security. Build essential skills and knowledge to meet your career or study goals. Topics you can cover include: When you graduate from this course you are likely to find work in a number of different fields including engineering, telecommunications, health, education, mining, law and government. Careers could include:",Not Mentioned,,no,yes,no,yes,no,[]
PG,Murdoch University,Perth,Master of Environmental Science,Creative Arts & Design & Music,,,AUD,year,1,Year,yes,yes,IELTS,,,6.5,,,https://www.murdoch.edu.au/study/courses/postgraduate/M1210,English,,"Effective management of human interactions with the environment requires thorough understanding of the inter-relationships between land, water, air, biota and people. As an environmental professional, you’ll need a clear understanding of the procedures and skills involved in investigating complex environmental issues in different settings such as urban, mining, agriculture, marine and freshwater. Improve your awareness of environmental issues from different perspectives so you are best equipped to find solutions that consider the technical, social and political needs in any scenario. You’ll gain specific knowledge in areas of particular interest to your current role, or the field you are aspiring to move into. Become a leader in environmental professional practice by gaining the interdisciplinary scientific and policy skills required to deal with today’s complex environmental problems, and be able to contribute to continuing improvement in environmental management practices. Build essential skills and knowledge to meet your career or study goals. Topics you’ll cover include: Our students have successfully gained employment in the public and private sectors, including the consulting industry in Australia and internationally. After completing this degree, you will be able to pursue careers in more senior positions in environmental consulting, monitoring and management, gain employment in the resources sector or work in technical or research roles in federal, state and local government departments with portfolios in environment, water, energy and mining, agriculture, nature conservation, biodiversity, coastal management and planning, or their international counterparts. Careers could include: Depending on your specialisation, you could be eligible to join the following professional bodies:",Not Mentioned,,no,yes,no,yes,no,[]
PG,Murdoch University,Perth,Master of Forensic Science (Professional Practice and Research),Engineering,,,AUD,year,2,Years,yes,yes,IELTS,,,6.5,,,https://www.murdoch.edu.au/study/courses/postgraduate/M1292,English,,"If you have a degree in science, or a relevant bachelor's degree, this course will give you the skills you need to help in criminal investigations. Reconstruct crime scenes as you learn to collect, process and interpret biological, chemical and physical evidence. Build your expertise in specimen preparation, sources of contamination, quality assurance, statistical interpretation and the admissibility of evidence as you learn to prepare and deliver courtroom testimony. You’ll complete a one-year research project within your master's degree, giving you specialist knowledge about a topic, and setting you up for potential progression to further research to a PhD. 6 reasons to study a Master of Forensic Science at Murdoch Develop your skills Build essential skills and knowledge to meet your career or study goals. Topics you’ll cover include: Your career You’ll graduate with the specialised skills you need to work with the police, national security and defence or other investigative authorities. Careers could include: You could also find work in pathology laboratories (such as toxicology, molecular diagnostics or paternity testing) or set up your own private consultancy.",Not Mentioned,,no,yes,no,yes,no,[]
PG,Murdoch University,Perth,Master of Forensic Science (Professional Practice),Engineering,,,AUD,year,2,Years,yes,yes,IELTS,,,6.5,,,https://www.murdoch.edu.au/study/courses/postgraduate/M1255,English,,"If you have a degree in science, or a relevant bachelor degree, this course will give you the skills you need to help in criminal investigations. Reconstruct crime scenes as you learn to collect, process and interpret biological, chemical and physical evidence. Build your expertise in specimen preparation, sources of contamination, quality assurance, statistical interpretation and the admissibility of evidence as you learn to prepare and deliver courtroom testimony. Build essential skills and knowledge to meet your career or study goals. Topics you’ll cover include: You’ll graduate with the specialised skills you need to work with the police, national security and defence or other investigative authorities. Careers could include: You could also find work in pathology laboratories (such as toxicology, molecular diagnostics or paternity testing) or set up your own private consultancy.",Not Mentioned,,no,yes,no,yes,no,[]
PG,Murdoch University,Perth,"Master of Health Administration, Policy and Leadership",English,,,AUD,year,2,Years,yes,yes,IELTS,,,6.5,,,https://www.murdoch.edu.au/study/courses/postgraduate/M1267,English,,"The health industry is changing rapidly. Change is driven by an ageing population, greater consumer expectations, digital and technological disruption, the burden of chronic diseases and a growing focus on data and privacy.  This is the only course of its kind in Australia, and is designed to help you become a fully informed and competent health industry leader and step up in your career. You can take advantage of our expertise in health research and teaching, with the opportunity to be taught by leading experts while connecting with industry employers at a local, national and international level. You can choose to specialise in the areas of health administration and leadership, evaluation and policy, or health informatics and analytics. You can also take a non-specialised approach for a broader and tailored pathway. Build essential skills and knowledge to meet your career or study goals. Topics you’ll cover include: Health is one of Australia’s largest industries, with more than one million people employed nationally. It is also our largest single employment sector here in WA, with an extra 798,000 healthcare jobs expected to become available by 2025.
Source: Job Outlook Professional 2018 Careers could include: International trends suggest an increasing demand for executives, managers, professionals, administrators and analysts working in the healthcare industry – and the specialised skills you gain in this course will help you graduate with a competitive edge in your career. This course is accredited by the Australasian College of Health Service Management (ACHSM), and recommended as an approved course by the Royal Australasian College of Medical Administrator (RACMA).",Not Mentioned,,no,yes,no,yes,no,[]
PG,Murdoch University,Perth,Master of Health Care Management,English,,,AUD,year,2,Years,yes,yes,IELTS,,,6.5,,,https://www.murdoch.edu.au/study/courses/postgraduate/M1217,English,,"Build your skills in leadership and management to further progress your health care career. This course is for you if you currently work in quality, safety, and risk roles within community, mental health, primary and aged care and are looking to transition into a management position, or are currently in a middle management position wishing to progress further. The course includes a focus on safety and quality to address the increased need for leadership and governance of healthcare for patient safety.  It provides the hard and soft skills needed within a clinical context, including leadership and managerial skills, financial management in healthcare, policy and human factor considerations. As part of the course you’ll undertake hands-on learning through project work, which focuses on an aspect learned within the course that can be applied to a clinical setting. This strong emphasis on professional practice is informed by research evidence, ensuring you have the concepts, insights and practical skills relevant to leading change and driving innovation in the healthcare sector. Build essential skills and knowledge to meet your career or study goals. Topics you’ll cover include: As a graduate of this course you will fulfil industry demand for increased middle management skills. The delivery of high quality services is essential within the health industry, particularly in private and aged care sectors. Careers could include:",Not Mentioned,,no,yes,no,yes,no,[]
PG,Murdoch University,Perth,Master of Human Resources Management,Tourism and Hotel Management,,,AUD,year,2,Years,yes,yes,IELTS,,,6.5,,,https://www.murdoch.edu.au/study/courses/postgraduate/M1213,English,,"Across all businesses and industries, the one thing that makes an organisation stand out from others is the people behind it. This coursework masters degree will allow you to plan and manage an organisation’s teams in ways which align with the organisation’s strategic goals and objectives. You’ll explore what makes a productive and sustainable workplace culture as you apply the new technologies and innovative HR solutions you learn. You’ll boost your HR expertise with new skills in talent management, performance management and people analytics.  Build essential skills and knowledge to meet your career or study goals. Topics you’ll cover include: By 2022, it’s expected there will be 89,000 new management jobs in Australia*. A postgraduate qualification can help you further your current career and move into a more senior role or help you change career paths to pursue new opportunities. *Source: Job Outlook WA Government 2019 Depending on your own situation and career aspirations, there are many careers and positions that this course can lead to. Careers could include: You’ll graduate with in-demand management skills, specialising in developing strategies to attract, retain, develop, engage and reward a capable workforce.",Not Mentioned,,no,yes,no,yes,no,[]
