Level_Code,University,City,Course,Faculty,Int_Fees,Local_Fees,Currency,Currency_Time,Duration,Duration_Time,Full_Time,Part_Time,Prerequisite_1,Prerequisite_2,Prerequisite_3,Prerequisite_1_grade,Prerequisite_2_grade,Prerequisite_3_grade,Website,Course_Lang,Availability,Description,Career_Outcomes,Country,Online,Offline,Distance,Face_to_Face,Blended,Remarks
PG,Murdoch University,Perth,Graduate Diploma in Psychology,Science and Health Science,,,AUD,year,1,Year,yes,yes,IELTS,,,6.5,,,https://www.murdoch.edu.au/study/courses/postgraduate/G1058,English,,"If you’re working towards becoming a registered psychologist and have already completed an accredited three-year undergraduate psychology degree or equivalent, this course provides you with an alternative option to an honours year to satisfy the educational requirements needed to register and work as a provisional psychologist. If you're in your last semester of your undergraduate psychology degree, you can apply for an early conditional offer based on your results to date. You will need a GPA of at least 2.0 in all psychology units. Students in the Graduate Diploma in Psychology must complete coursework at an advanced level as well as a group-based research project written up as an individual thesis. On completion of this course, you can apply for a masters program in Psychology like the Master of Applied Psychology (Professional) or Master of Applied Psychology (Clinical). 4 reasons to study a Graduate Diploma in Psychology at Murdoch Develop your skills Build essential skills and knowledge to meet your career or study goals. Topics you’ll cover include: Your career After obtaining the Graduate Diploma in Psychology degree, you can explore working in diverse areas both in public and private sectors because the skills and knowledge acquired throughout the Graduate Diploma in Psychology are highly versatile and applicable to many fields. You can be involved in policymaking, police and correction services, counselling services, market and consumer research, career guidance, and more. Graduate Careers Australia outlines some areas you might work in after graduating with a Psychology degree. Professional recognition This course is fully accredited by the Australian Psychology Accreditation Council (APAC), and is recognised by the Australian Psychological Society (APS) and the Western Australian Psychologists’ Registration Board. As a graduate, you will have satisfied the minimum educational requirements for provisional registration to work as a psychologist in Australia (provided that your undergraduate degree is from an accredited psychology program), and will also be eligible to apply for entry into relevant Master courses in applied psychology.",Not Mentioned,,no,yes,no,yes,no,[]
PG,Murdoch University,Perth,Graduate Diploma in Safety Science,Science and Health Science,,,AUD,year,1,Year,yes,yes,IELTS,,,6.5,,,https://www.murdoch.edu.au/study/courses/postgraduate/G1078,English,,"The welfare and protection of people in the workplace from incidents such as accidents, explosions, fires, and generally health-threatening conditions is the responsibility of industry and government agencies. Their role is to avoid costs for individuals, workplaces and the entire nation. This has created a huge demand for professionals with qualifications in Safety Science, as employers are hiring staff to manage and minimise such risks.  Experts in this expanding field range from social scientists to engineers. In this course, you’ll cover the disciplines of science, safety, health and environment and will gain a valuable insight into engineering, systems analysis, management, human relations and communications. This will equip you with the cutting-edge knowledge pertinent to understanding the behavioural-based safety and risk management policies. You’ll also develop the essential employment requirements that businesses demand of OSH professionals, such as knowledge of process safety and engineering concepts to improve safety culture, behavioural-based safety and change management principles. Build essential skills and knowledge to meet your career or study goals. Topics you’ll cover include: This course is designed for working professionals who wish to advance their career in this growing field. It also provides the opportunity for recent graduates to gain post-graduate qualifications in Safety Science and enhance their employment opportunities. Careers could include:",Not Mentioned,,no,yes,no,yes,no,[]
PG,Murdoch University,Perth,Graduate Diploma in Systems Medicine,Computer Science & Information Technology,,,AUD,year,1,Year,yes,yes,IELTS,,,6.5,,,https://www.murdoch.edu.au/study/courses/postgraduate/G1089,English,,"This degree builds on the Graduate Certificate course and is designed to provide you with systematic training in individual components of systems medicine.  As part of the Graduate Diploma course, you will have a unique opportunity to build basic and general research skills in conducting a real-world clinical research project in the state-of-the art laboratory under the supervision of leading researchers. Topics covered include genomics, proteomics, transcriptomics, metagenomics and metabonomics (metabolomics).  A strong focus is placed on metabolic phenotyping and computational biology, which will be supported by access to facilities within the Australian National Phenome Centre (ANPC) and Centre for Computational and Systems Medicine (CCSM). You will gain theoretical knowledge and practical experience and understand its application in areas of unmet medical needs such as maternal and early life, aging and neuropathology and cardiometabolic diseases. You will also develop various transferable skills such as problem solving, critical thinking and team-building. This course will prepare you for employment in the increasingly multidisciplinary and borderless clinical and biomedical environments. Build essential skills and knowledge to meet your career or study goals. Topics you’ll cover include: You’ll graduate with the theoretical knowledge and specialised practical skills required for employment in multiple areas of biomedical and clinical research as well as application into agriculture and veterinary sciences. Graduates will be suited to careers in hospitals, universities and higher education establishments, pharmaceutical and food industries, start-ups in the biomedical sector, government advisory bodies, scientific management or data science. This course will also prepare you for progression onto a Master level training program.",Not Mentioned,,no,yes,no,yes,no,[]
PG,Murdoch University,Perth,Graduate Diploma in Web Communication,Computer Science & Information Technology,,,AUD,year,1,Year,yes,yes,IELTS,,,6.5,,,https://www.murdoch.edu.au/study/courses/postgraduate/G1071,English,,"Learn the essential practical, theoretical and technical skills necessary for digital communication. You’ll learn the core communication areas of social media strategy, search engine optimisation, digital content strategy and web analytics. Throughout this project-based course you'll cover all aspects of a web communication campaign, from developing digital personae to pitching ideas to a client. You’ll learn how web communication works in business, society and in the political realm, while learning how to plan social media and digital communication campaigns for different target audiences. Develop your knowledge in web communication strategy, digital platforms (such as websites and social media) and data analysis so that you can maximise your opportunities and reach in this continually changing professional landscape. This course has a very practical focus and you will learn through doing. 8 reasons to study a Graduate Diploma in Web Communication at Murdoch Develop your skills Build essential skills and knowledge to meet your career or study goals. Topics you’ll cover include: Your career This course will prepare you to work across just about any industry or business engaging with the web and social media. Careers could include: Communication stretches across all business and industry so you could find yourself working in government, private enterprise or for a NGO.",Not Mentioned,,no,yes,no,yes,no,[]
PG,Murdoch University,Perth,Industrial Control Systems Engineering,Engineering,,,AUD,year,Not mentioned,Not mentioned,no,no,IELTS,,,6.5,,,https://www.murdoch.edu.au/study/courses/postgraduate/MJ-ICSD,English,,"By choosing to major in industrial control systems engineering, you’ll build the expertise you need for a range of career options. You could work in engineering roles in manufacturing, medical, mining, processing, energy supply, communications, electronics, computer‐systems or defence‐related industries. This qualification is designed to add to your existing qualification or expand your knowledge and skills in the areas of instrumentation, industrial computer systems, and control engineering. After completing this course on a full-time or part-time basis, you can graduate with a Graduate Diploma in Engineering or apply for further study to complete a Masters in Engineering. 3 reasons to study Engineering at Murdoch What you’ll learn Your future career This course will provide you with the knowledge and skills in instrumentation, control and computer systems engineering you need for a range of industries including mining, oil and gas, chemical and mineral processing, food and pharmaceuticals, electronics and communications. Your career options could include roles as a: Professional recognition This course is designed to maintain and/or further the needs of Continuing Professional Education of Engineers in the areas of the specific major.   For further admission information about this course, please download our Information Pack.",Control and Instrumentation Engineer / Control Systems Engineer / Systems Assurance Engineer / Functional Safety Engineer / Asset Maintenance and Planning / Industrial Network Engineer / Instrumentation Systems Engineer,,no,yes,no,yes,no,[]
PG,Murdoch University,Perth,Industrial Control Systems Engineering ,Engineering,,,AUD,year,Not mentioned,Not mentioned,yes,yes,IELTS,,,6.5,,,https://www.murdoch.edu.au/study/courses/postgraduate/MJ-ICS,English,,"Keeping the world connected in a digital age depends on a reliable and efficient power supply, with increasing emphasis on computing technologies to monitor and control energy distribution. You’ll explore power systems and their components and learn how to effectively design and plan smart power systems to increase reliability and stability of power supply. You’ll also learn about the effects of distributed generation such as rooftop photovoltaic, energy storage, and demand response on power delivery networks and cover advanced concepts associated with the planning and operation of power systems. Learn about the use and application of computing technologies in the operation of modern industrial plants, manufacturing processes and material processing industries, with a focus on computer-based measurement and control. You’ll understand how to design, commission and test complex industrial control systems and have the opportunity to design, commission and test small-scale systems (including programming, networking and interfacing to instruments). Build essential skills and knowledge to meet your career or study goals. Topics you’ll cover include: This course will prepare you for a range of career opportunities designing, maintaining and deploying the infrastructure needed to generate and distribute electricity around the world using both traditional and renewable energy sources. Providing the platform for a career in energy supply, mining and processing, communications, electronics and computer systems, information technology, manufacturing, medical and defence-related industries. Careers could include: This course can be used to meet the continuing professional education requirements of engineers in the areas of electrical power and industrial computer systems engineering.",Not Mentioned,,no,yes,no,yes,no,[]
PG,Murdoch University,Perth,Information Technology Management,Computer Science & Information Technology,,,AUD,year,Not mentioned,Not mentioned,yes,yes,IELTS,,,6.5,,,https://www.murdoch.edu.au/study/courses/postgraduate/MJ-ITMA,English,,"Get prepared for an exciting management career in the field of IT as you learn the specialised skills and techniques that are in demand across the world. You’ll study knowledge management, data resources management and business analysis and get hands-on experience in our IT Innovation Hub. This course has been designed in consultation with our industry partners, so you’ll learn to identify and resolve real-world IT challenges. If you’re eligible, you could complete this course through part-time study, so you can juggle your studies with your career and lifestyle commitments. 3 reasons to study Information Technology Management at Murdoch    What you’ll learn Your future career With a postgraduate qualification in IT, you’ll be qualified for a range of career opportunities across every industry. Your future roles could include a range of supervisory or management roles such as: Professional recognition When you graduate, you’ll be ready to sit for industry certification exams, including Cisco Certified Network Associate (CCNA), Certified Wireless Network Administrator (CWNA) and Cisco Certified Network Professional (CCNP).   For further admission information about this course, please download our Information Pack.",Chief Information Officer / IT Project Manager / Information Systems Manager / Technology Strategist / Business Intelligence Officer,,no,yes,no,yes,no,[]
PG,Murdoch University,Perth,Information Technology Management (with Dissertation),Computer Science & Information Technology,,,AUD,year,Not mentioned,Not mentioned,yes,yes,IELTS,,,6.5,,,https://www.murdoch.edu.au/study/courses/postgraduate/MJ-ITMDA,English,,"Across the world, there’s a growing need for IT professionals who can not only understand and solve complex problems, but also make informed decisions and lead a team. In this course you’ll build specialised skills in knowledge management, data resources management and business analysis and get hands-on experience in our IT Innovation Hub. You’ll earn credit points by completing a dissertation as part of this course. Working closely with a supervisor, you’ll choose a topic and explore new approaches to information technology management and the latest developments in your area of interest. If you’re eligible, you could complete this course through part-time study, so you can juggle your studies with your career and lifestyle commitments. 3 reasons to study Information Technology Management at Murdoch What you’ll learn Your future career With a postgraduate qualification in IT, you’ll be qualified for a range of career opportunities across every industry. Your future roles could include a range of supervisory or management roles such as: Professional recognition When you graduate, you’ll be ready to sit for industry certification exams, including Cisco Certified Network Associate (CCNA), Certified Wireless Network Administrator (CWNA) and Cisco Certified Network Professional (CCNP).   For further admission information about this course, please download our Information Pack.",Chief Information Officer / IT Project Manager / Information Systems Manager / Technology Strategist / Business Intelligence Officer,,no,yes,no,yes,no,[]
PG,Murdoch University,Perth,"Instrumentation, Control and Industrial Computer Systems Engineering",Engineering,,,AUD,year,Not mentioned,Not mentioned,yes,yes,IELTS,,,6.5,,,https://www.murdoch.edu.au/study/courses/postgraduate/MJ-ICICG,English,,"Engineering systems are complex and require careful management and control to ensure they operate efficiently and safely. You’ll learn about classical and advanced control systems concepts, and how to design, test and commission instrument and control systems. You’ll work on large-scale case studies and use engineering software packages to model and simulate processes, design and implement appropriate control systems, and evaluate the performance of those systems. You’ll also learn how to identify suitable performance indicators to ensure the efficiency and safety of engineering systems. Develop the use and application of computing technologies in the operation of modern industrial plants, manufacturing processes and material processing industries, with a focus on computer-based measurement and control. You’ll understand how to design, commission and test complex industrial control systems and have the opportunity to design, commission and test small-scale systems involving programming, networking and interfacing to instruments. Build essential skills and knowledge to meet your career or study goals. Topics you’ll cover include: This course will provide you with the knowledge and skills in instrumentation, control and computer systems engineering you need for a range of industries including mining, oil and gas, chemical and mineral processing, food and pharmaceuticals, electronics and communications. Careers could include: This course can be used to meet the continuing professional education requirements of engineers in the areas of electrical power and industrial computer systems engineering.",Not Mentioned,,no,yes,no,yes,no,[]
PG,Murdoch University,Perth,Internetworking and Security,Humanities and Social Science,,,AUD,year,Not mentioned,Not mentioned,yes,yes,IELTS,,,6.5,,,https://www.murdoch.edu.au/study/courses/postgraduate/MJ-INSA,English,,"There’s a growing global demand for IT professionals who can establish, maintain and develop information systems. This major will boost your career prospects across every sector, including commerce, telecommunications, health, education, architecture, mining, engineering, law and government and non-government organisations. This course has a flexible structure, so depending on the units you choose, you could build your expertise in security, LAN and Wireless network design, global network design or network management. If you’re eligible, you could complete this course through part-time study, so you can juggle your studies with your career and lifestyle commitments. 3 reasons to study Internetworking & Security at Murdoch What you’ll learn Your future career With a postgraduate qualification in IT, you’ll be qualified for a range of career opportunities across every industry. Your future roles could include: Professional recognition When you graduate, you’ll be ready to sit for industry certification exams, including Cisco Certified Network Associate (CCNA), Certified Wireless Network Administrator (CWNA) and Cisco Certified Network Professional (CCNP).   For further admission information about this course, please download our Information Pack.",Chief Information Officer / IT Project Manager / Network Administrator / Data Analyst / Business Intelligence Officer,,no,yes,no,yes,no,[]
PG,Murdoch University,Perth,Internetworking and Security (with Dissertation),Humanities and Social Science,,,AUD,year,Not mentioned,Not mentioned,yes,yes,IELTS,,,6.5,,,https://www.murdoch.edu.au/study/courses/postgraduate/MJ-INSDA,English,,"There’s a growing global demand for IT professionals who can establish, maintain and develop information systems. This major will boost your career prospects across every sector, including commerce, telecommunications, health, education, architecture, mining, engineering, law and government and non-government organisations. This major has a flexible structure, so depending on the units you choose, you could build your expertise in security, LAN and Wireless network design, global network design or network management. You’ll earn credit points by completing a dissertation as part of this course. Working closely with a supervisor, you’ll choose a topic and explore new scientific approaches and the latest developments in your area of interest. If you’re eligible, you could complete this course through part-time study, so you can juggle your studies with your career and lifestyle commitments. 3 reasons to study Internetworking & Security at Murdoch What you’ll learn Your future career With a postgraduate qualification in IT, you’ll be qualified for a range of career opportunities across every industry. Your future roles could include: Professional recognition When you graduate, you’ll be ready to sit for industry certification exams, including Cisco Certified Network Associate (CCNA), Certified Wireless Network Administrator (CWNA) and Cisco Certified Network Professional (CCNP).   For further admission information about this course, please download our Information Pack.",Chief Information Officer / IT Project Manager / Network Administrator / Data Analyst / Business Intelligence Officer,,no,yes,no,yes,no,[]
PG,Murdoch University,Perth,IT Management,Computer Science & Information Technology,,,AUD,year,Not mentioned,Not mentioned,yes,yes,IELTS,,,6.5,,,https://www.murdoch.edu.au/study/courses/postgraduate/MJ-ITMC,English,,"Take your IT qualification even further by learning the kind of management skills and techniques that are in demand across the world. You’ll study knowledge management, data resources management and business analysis and get hands-on experience in our IT Innovation Hub. This course has been designed in consultation with our industry partners, so you’ll learn to identify and resolve real-world IT challenges. If you’re eligible, you could complete this course through part-time study, so you can juggle your studies with your career and lifestyle commitments. 3 reasons to study Information Technology Management at Murdoch What you’ll learn Your future career With a postgraduate qualification in IT, you’ll be qualified for a range of career opportunities across every industry. Your future roles could include a range of supervisory or management roles such as: Professional recognition When you graduate, you’ll be ready to sit for industry certification exams, including Cisco Certified Network Associate (CCNA), Certified Wireless Network Administrator (CWNA) and Cisco Certified Network Professional (CCNP).   For further admission information about this course, please download our Information Pack.",Chief Information Officer / IT Project Manager / Information Systems Manager / Technology Strategist / Business Intelligence Officer,,no,yes,no,yes,no,[]
PG,Murdoch University,Perth,IT Management (with Dissertation),Computer Science & Information Technology,,,AUD,year,Not mentioned,Not mentioned,yes,yes,IELTS,,,6.5,,,https://www.murdoch.edu.au/study/courses/postgraduate/MJ-ITMD,English,,"Every industry needs more qualified professionals in the field of information technology. Get the specialised skills you need to lead a team as you explore knowledge management, data resources management and business analysis. You’ll earn credit points by completing a dissertation as part of this course. Working closely with a supervisor, you’ll choose a topic and explore new approaches to information technology management and the latest developments in your area of interest. If you’re eligible, you could complete this course through part-time study, so you can juggle your studies with your career and lifestyle commitments. 3 reasons to study Information Technology Management at Murdoch What you’ll learn Your future career With a postgraduate qualification in IT, you’ll be qualified for a range of career opportunities across every industry. Your future roles could include a range of supervisory or management roles such as: Professional recognition When you graduate, you’ll be ready to sit for industry certification exams, including Cisco Certified Network Associate (CCNA), Certified Wireless Network Administrator (CWNA) and Cisco Certified Network Professional (CCNP).   For further admission information about this course, please download our Information Pack.",Chief Information Officer / IT Project Manager / Information Systems Manager / Technology Strategist / Business Intelligence Officer,,no,yes,no,yes,no,[]
