Level_Code,University,City,Course,Faculty,Int_Fees,Local_Fees,Currency,Currency_Time,Duration,Duration_Time,Full_Time,Part_Time,Prerequisite_1,Prerequisite_2,Prerequisite_3,Prerequisite_1_grade,Prerequisite_2_grade,Prerequisite_3_grade,Website,Course_Lang,Availability,Description,Career_Outcomes,Country,Online,Offline,Distance,Face_to_Face,Blended,Remarks
BA,Murdoch University,Perth,Instrumentation and Control Engineering,Engineering,,,AUD,year,Not mentioned,Not mentioned,yes,yes,year 12,IELTS,,,6.0,,https://www.murdoch.edu.au/study/courses/undergraduate/MJ-IC,English,,"As an instrumentation and control engineer, you are responsible for designing, installing and monitoring equipment to control engineering systems, machinery and processes. In this degree, you’ll learn how to design, commission and test complex industrial control systems.  By exploring state-of-the art technologies, you’ll learn how to design and operate your own multivariable controllers in a pilot plant, which mirrors actual large-scale industrial operations. Gain hands-on skills from industry experts to prepare you for a range of careers in sectors such as mining, oil and gas, renewable energy and utility supply. A final honours year is embedded in this degree, meaning you’ll be able to apply everything you learn in your first three years of study. If you’re unable to gain entry into this course, you can apply for the Bachelor of Science in Engineering Technology and transfer across to this major at the end of your first year of study. 5 reasons to study Instrumentation and Control Engineering at Murdoch What you’ll learn Build the knowledge and skills you need to meet your career or study goals. Here are some of the things you’ll learn: Your future career Graduating with a major in Instrumentation and Control Engineering opens the door to a wide range of career opportunities across industry sectors. Careers could include: Professional recognition Our Engineering degrees are accredited by Engineers Australia. As a graduate, you can become a graduate member of Engineers Australia.  You could become a Full Chartered Professional Engineer after a further three-to-five years of engineering work experience. For further admission information about this course, please download our Information Pack.",Control and Instrumentation Engineer / Functional Safety Engineer / Control Systems Engineer / Process Control Engineer / Instrumentation Systems Engineer.,,no,yes,no,yes,no,[]
BA,Murdoch University,Perth,International Aid and Development,Humanities and Social Science,,,AUD,year,Not mentioned,Not mentioned,yes,yes,year 12,IELTS,,70,6.0,,https://www.murdoch.edu.au/study/courses/undergraduate/MJ-IADA,English,,"It’s a sad reality that millions of people around the world are living in poverty. International aid and development can come in many forms including money, medicine, food, education, disaster relief and recovery, helping communities develop a better future, and much more. In this course, you’ll explore the challenges and the changing approaches to international aid by governments, international organisations and aid agencies, and gain an in-depth understanding of international development programs and approaches. An important part of international aid and development is helping people to help create change themselves. You’ll focus on how to work with people to help them develop skills for what’s known as participatory development practice. This is a process that empowers people with the skills, knowledge and access to resources they need to make a lasting difference in their own community. 6 reasons to study International Aid and Development at Murdoch What you’ll learn Build the knowledge and skills you need to meet your career or study goals. Here are some of the things you’ll learn: Career opportunities With a degree in International Aid and Development, you could work in a range of roles in Australia or overseas. Careers could include: You might work in international agencies or organisations such as the United Nations, UNICEF and the International Committee of the Red Cross, non-government organisations (NGOs) such as Oxfam, World Vision and CARE, government agencies such as the Department of Foreign Affairs and Trade, or pursue many other opportunities. For further admission information about this course, please download our Information Pack.",Not Mentioned,,no,yes,no,yes,no,[]
BA,Murdoch University,Perth,International Business,Business & Commerce & Finance & Accounting,,,AUD,year,Not mentioned,Not mentioned,yes,yes,year 12,IELTS,,70,6.0,,https://www.murdoch.edu.au/study/courses/undergraduate/MJ-INTBA,English,,"In Australia and across the world, organisations are looking for ways to expand and operate across international borders. This course is the only one of its kind in WA, giving you the skills and experience you need to succeed in the world of international business. As you develop your strategic decision-making abilities, put your cross-cultural skills into practice and explore new ways of thinking, you’ll build a skillset that would be essential to practically any business operation. You’ll explore management, marketing and finance, which will provide you with a global perspective and allow you to get results doing business across international borders. 3 reasons to study International Business at Murdoch What you’ll learn Build the knowledge and skills you need to meet your career or study goals. Here are some of the things you’ll learn: Your future career You could work in practically any industry or sector. Careers could include: You might work for state and federal government agencies, non-governmental organisations (known as NGOs), not-for-profit organisations, major international brands or in other areas. For more details about this course, please download our information pack.",Business Manager / International Marketing Manager / Import/Export Advisor / International Engagement Officer / Foreign Affairs Advisor,,no,yes,no,yes,no,[]
BA,Murdoch University,Perth,Internetworking and Network Security,Humanities and Social Science,,,AUD,year,Not mentioned,Not mentioned,yes,yes,year 12,IELTS,,,6.0,,https://www.murdoch.edu.au/study/courses/undergraduate/BH-INW,English,,"If you receive excellent results throughout your undergraduate Internetworking and Network Security degree, you may be eligible to undertake Honours in Internetworking and Network Security. This is an additional year of study designed to further the knowledge you’ve developed throughout your undergraduate Internetworking and Network Security course. Working closely with an academic, you’ll undertake an intensive research project on a topic of your choice, and further develop your research ability through an advanced research skills unit and some additional coursework.",Not Mentioned,,no,yes,no,yes,no,[]
BA,Murdoch University,Perth,Internetworking and Network Security,Humanities and Social Science,,,AUD,year,Not mentioned,Not mentioned,yes,yes,year 12,IELTS,,70,6.0,,https://www.murdoch.edu.au/study/courses/undergraduate/MJ-INS,English,,"Organisations are increasingly concerned with network performance and security. Develop the skills in demand and have the flexibility to tailor your degree to meet your career needs.  You can choose units to develop skills in security, LAN and wireless network design, global network design or network management. This specialisation will also prepare you to sit one or more industry certification exams.  These include Cisco Certified Network Associate (CCNA), Certified Wireless Network Administrator (CWNA), Cisco Certified Network Professional (CCNP) Managing Cisco Network Security (MCNS) and Cisco Secure PIX Firewall Advanced (CSPFA).  Upon successful completion of this course, you will be eligible to apply for the Master of Information Technology. 3 reasons to study Cyber Security and Networking at Murdoch Develop your skills Build essential skills and knowledge to meet your career or study goals. Topics you’ll cover include: Your career As a graduate of the Graduate Diploma in Internetworking and Security, you’ll be able to choose from a variety of roles concerned with network performance and security. You could work in a range of public and private organisations such as network service providers, banking and finance organisations or the government and military. Careers could include: Professional recognition This degree can prepare you for industry certification exams.  These include Cisco Certified Network Associate (CCNA), Certified Wireless Network Administrator (CWNA), Cisco Certified Network Professional (CCNP) Managing Cisco Network Security (MCNS) and Cisco Secure PIX Firewall Advanced (CSPFA).",Not Mentioned,,no,yes,no,yes,no,[]
BA,Murdoch University,Perth,Japanese,Culture,,,AUD,year,Not mentioned,Not mentioned,yes,yes,year 12,IELTS,,70,6.0,,https://www.murdoch.edu.au/study/courses/undergraduate/MJ-JPNA,English,,"Japan is famous for its pop culture, great food, long history, rich traditions, beautiful seasons and nature, advanced technology, and much more. It is also one of Australia’s major economic and political partners, as well as in cultural exchange, and research and development. Develop your ability to engage professionally with the people and culture of Japan. This course focuses on a communicative approach, which steadily builds your proficiency in the four skills of listening, speaking, reading and writing contemporary Japanese, as well as learning about many aspects of Japanese culture and society. This course features integration of on-campus learning and in-country study which allows students to undertake an exchange program in Japan. After completing either your second or third-year units in Japanese language, you’ll have the opportunity to study for one or two semesters at one of our 10 Japanese partner universities. If you have completed ATAR Japanese, you might be eligible for our fast-track course, where you can skip first-year Japanese units. 7 reasons to study Japanese at Murdoch What you’ll learn Build the knowledge and skills you need to meet your career or study goals. Here are some of the things you’ll learn: Your future career When you graduate, you’ll have the language skills and cultural knowledge needed to work in a broad range of industries, both locally and internationally. Careers could include: Professional recognition You can apply for professional accreditation as an interpreter and translator through testing by the National Accreditation Authority for Translators and Interpreters (NAATI). For further admission information about this course, please download our Information Pack.",Diplomat / Interpreter or Translator / Hospitality or Tourism Operator / Teacher or Academic / Professional in Japan.,,no,yes,no,yes,no,[]
BA,Murdoch University,Perth,Journalism,Mass Communication & Media,,,AUD,year,Not mentioned,Not mentioned,yes,yes,year 12,IELTS,,70,6.0,,https://www.murdoch.edu.au/study/courses/undergraduate/MJ-JNL,English,,"In our Journalism course, you’ll develop the skills you need to thrive in the digital era of news. Learn everything you need to know to work within a professional news organisation, gathering information and producing editorial content in text, audio and video and multimedia formats. You’ll learn the skills you need to get a job in today’s evolving media landscape, from practical reporting and writing, through to using social media and video journalism, and learning how to manage the back end of a website. You will learn how to use Adobe Photoshop, Premiere Pro and Audition, as well as drones to capture stories from a completely different angle. You will investigate the ethical, legal and cultural contexts of the media, analyse the influence journalism has on society as well as the rapidly changing world of news delivery. You have the choice to focus on broadcasting or digital journalism. If you are interested in radio broadcasting, we recommend you also take the minor in Radio, which gives you live, on-air experience through Radio Fremantle and other radio productions. With the help of our industry-experienced lecturers, you’ll conduct interviews, shoot photos and videos and create multimedia content to tell amazing stories. In your final unit, your stories will be written and uploaded to our student news website, as you work in an online newsroom and find out how the industry really works. 7 reasons to study Journalism at Murdoch What you’ll learn Build the knowledge and skills you need to meet your career or study goals. Here are some of the things you’ll learn: Your future career When you graduate you can follow a career in the media industry or work for yourself as a freelance writer or producer. You will have the skills to research, write and communicate effectively- all are useful in corporate and public sector settings. Careers could include: For further admission information about this course, please download our Information Pack.",Journalist / Freelance Writer / TV News Reporter/Producer / Foreign Correspondent / Radio Journalist/Presenter / Media Liaison Officer / Documentary Producer.,,no,yes,no,yes,no,[]
BA,Murdoch University,Perth,Laboratory Medicine,Medical and Nursing,,,AUD,year,Not mentioned,Not mentioned,yes,yes,year 12,IELTS,,70,6.0,,https://www.murdoch.edu.au/study/courses/undergraduate/MJ-LAB,English,,"Immerse yourself in the fascinating world of disease as you build a strong foundation for your future career in Laboratory Medicine. Clinical terminology like haematology (the study and treatment of blood), immunology (the study of the immune system and how our bodies protect us from pathogens), histopathology (the study of how disease causes changes in tissues) and molecular pathology (the examination of molecules within organs, tissues and fluids) will become part of your professional vocabulary as you develop skills in the handling of patient material and laboratory testing to guide medical decision making. Laboratory Medicine is a four-year course in which you can pursue a specific area of interest by selecting one of three streams – Biomedical Science, Genetics and Molecular Biology or Forensic Biology and Toxicology. In the fourth year, you will also take part in Murdoch's Work Integrated Learning, which allows you to apply your knowledge in a workplace environment. Build the knowledge and skills you need to meet your career or study goals. Here are some of the things you’ll learn: Pursue a range of roles in public or private diagnostic pathology, research or working in laboratories as a technician. You could also explore the fields of medical and life science research, marketing, media and academia, or take on further studies in medicine, pharmacy, dentistry and veterinary science. Careers could include: This course is accredited by the Australian Institute of Medical Scientists (AIMS). For further admission information about this course, please download our Information Pack.","Five-star rating for student-teacher ratio, overall experience, student support and teaching quality.* *Source:Good Universities Guide 2020. / You’ll study in a major health precinct including three hospitals and a medical research institute. / You’ll learn from lecturers who are making a real-word impact with their research and have extensive experience in laboratory medicine. / Prepare for the workforce or further study with the inclusion of cutting-edge advances in modern diagnostic science. / Learn on the latest instrumentation as part of our extensive hands-on practical training, including industry placements within diagnostic pathology laboratories. / If you’re aiming to study postgraduate medicine (or other medically-related vocations), you’ll be well prepared to apply when you finish this course. / You will have honours and higher research opportunities both on and off campus thanks to our strong links to Perth’s medical research institutes.",,no,yes,no,yes,no,[]
BA,Murdoch University,Perth,Law,Law,,,AUD,year,Not mentioned,Not mentioned,yes,yes,year 12,IELTS,,90,6.0,,https://www.murdoch.edu.au/study/courses/undergraduate/MJ-LAW,English,,"Do you believe that all people should have the right to access education, health, justice and opportunities to succeed? This is a concept known as social justice; it is based on a framework of human rights – and it’s what inspires many of our Law students to get the skills and knowledge they need to go out and stand up for the rights of others. In this degree, you’ll take a hands-on approach to the law and develop strong real-life legal skills through our clinical program with partners such as SCALES Community Legal Centre. In this program, you will work on real cases with real clients and get new insight into the legal system. You will also further develop your reasoning skills in our internationally-recognised mooting program. Mooting is a simulated court proceeding where you will be presented with a legal problem and argue it before a 'judge' in our purpose-built courtroom. You can complete this degree in just four years or sooner by taking advantage of our summer and winter intensive schedule. We also have mid-year entry available. 12 reasons to study Law at Murdoch What you’ll learn Build the knowledge and skills you need to meet your career or study goals. Here are some of the things you’ll learn: Your future career Studying law can lead to a career in any area or industry, from navigating human rights to exploring emerging fields such as artificial intelligence. You could work in the public or private sector, fighting for the rights of those who are disadvantaged or unfairly treated, and creating a better society. Careers could include: You don’t have to become a lawyer and there are many other career paths you could pursue. You could become a business law consultant, work in negotiation and conflict resolution, work in government or politics, become a writer or journalist or pursue many other opportunities. Professional recognition The Bachelor of Laws (LLB) degree meets the educational requirements of the Legal Practice Board of Western Australia for admission as a practising lawyer. If you would like to become a practising lawyer, you can complete your practical legal training (known as PLT) on campus thanks to our partnerships with Leo Cussen and College of Law. This degree is accredited by the Ministry of Law in Singapore, the Malaysian Bar Council and the Indian Bar Council. For further admission information about this course, please download our Information Pack.","Lawyer / Solicitor or Barrister / roles in federal, state or local government / legal advisor in the corporate sector or a community legal centre / Legal Analyst.",,no,yes,no,yes,no,[]
PG,Murdoch University,Perth,Law - Graduate Entry,Law,,,AUD,year,Not mentioned,Not mentioned,yes,yes,year 12,IELTS,,,6.0,,https://www.murdoch.edu.au/study/courses/undergraduate/MJ-GLW,English,,"If you have already completed an undergraduate degree in any discipline you can apply for the Graduate Entry Law. This course allows you to complete our Bachelor of Laws in just three years, adding to your existing studies and allowing you to begin your career journey to becoming a lawyer or legal practitioner. As a graduate entry student, you’ll be awarded 24 points of advanced standing and then need to follow a set structure of required units if you’d like to complete your Law degree in the minimum time. The core law units will give you an understanding of the Australian legal system and specialist areas of law. Benefit from the same opportunities as other Law students by taking a hands-on approach to the law. Develop strong real-life legal skills through our clinical program with partners such as SCALES Community Legal Centre. In this program, you will work on real cases with clients and get new insight into the legal system. You will also further develop your reasoning skills in our internationally-recognised mooting program. Mooting is a simulated court proceeding where you will be presented with a legal problem and argue it before a 'judge' in our purpose-built courtroom. Mid-year entry available. 13 reasons to study Law at Murdoch What you’ll learn Build the knowledge and skills you need to meet your career or study goals. Here are some of the things you’ll learn: Your future career Studying law can lead to a career in any area or industry, from navigating human rights to exploring emerging fields such as artificial intelligence. You could work in the public or private sector, fighting for the rights of those who are disadvantaged or unfairly treated, and creating a better society. Careers could include: You don’t have to become a lawyer and there are many other career paths you could pursue. You could become a business law consultant, work in negotiation and conflict resolution, work in government or politics, become a writer or journalist or pursue many other opportunities. Professional recognition The Bachelor of Laws (LLB) degree meets the educational requirements of the Legal Practice Board of Western Australia for admission as a practising lawyer. If you would like to become a practising lawyer, you can complete your practical legal training (known as PLT) on campus thanks to our partnerships with Leo Cussen and College of Law. This degree is accredited by the Ministry of Law in Singapore, the Malaysian Bar Council and the Indian Bar Council. For further admission information about this course, please download our Information Pack.","Lawyer / Solicitor or Barrister / Roles in federal, state or local government / Legal advisor in the corporate sector or a community legal centre / Legal analyst.",,no,yes,no,yes,no,[]
PG,Murdoch University,Perth,Legal Studies,Law,,,AUD,year,Not mentioned,Not mentioned,yes,yes,year 12,IELTS,,70,6.0,,https://www.murdoch.edu.au/study/courses/undergraduate/MJ-LEGS,English,,"If you’re looking for an exciting career and the chance to make a difference, a major in Legal Studies within the field of criminology could really take you places. You’ll examine the Australian legal system and the way it shapes our society through a range of issues such as welfare law and human trafficking. Law transcends all industries. Find out how the law interacts with other areas, taking units in criminology as you study the foundations of business law and other areas of the law. You’ll learn about dispute resolution and have the opportunity to develop your own dispute resolution skills through role play and interactive activities. You will learn a variety of dispute resolution processes including negotiation, conciliation, mediation and arbitration.   You will investigate the interactions between law, crime, frameworks in societies and the various social grouping within society. 8 reasons to study Legal Studies at Murdoch What you’ll learn Build the knowledge and skills you need to meet your career or study goals. Here are some of the things you’ll learn: Your future career Studying a Bachelor of Criminology in Legal Studies will set you up for a career in the criminal justice system. Careers could include: You’ll graduate with the skills you need to pursue roles within the court and corrections, police services, youth work, community groups and government departments For further admission information about this course, please download our Information Pack.",Community Correction Officer / Juvenile Justice Officer / Criminologist / Paralegal Officer / Court Administrator.,,no,yes,no,yes,no,[]
PG,Murdoch University,Perth,Management,Business & Commerce & Finance & Accounting,,,AUD,year,Not mentioned,Not mentioned,yes,yes,year 12,IELTS,,,6.0,,https://www.murdoch.edu.au/study/courses/undergraduate/BH-MGT,English,,"If you receive excellent results throughout your undergraduate Management degree, you may be eligible to undertake Honours in Management. This is an additional year of study designed to further the knowledge you’ve developed throughout your undergraduate Management course. Working closely with an academic, you’ll undertake an intensive research project on a topic of your choice, and further develop your research ability through an advanced research skills unit and some additional coursework.",Not Mentioned,,no,yes,no,yes,no,[]
